No.     Time           Source                Destination           Protocol Length Info
      1 0.000000000    10.0.2.15             142.251.209.142       TCP      74     38310 → 443 [SYN] Seq=0 Win=64240 Len=0 MSS=1460 SACK_PERM=1 TSval=2637099022 TSecr=0 WS=128

Frame 1: 74 bytes on wire (592 bits), 74 bytes captured (592 bits) on interface enp0s3, id 0
Ethernet II, Src: PcsCompu_e2:fb:80 (08:00:27:e2:fb:80), Dst: RealtekU_12:35:02 (52:54:00:12:35:02)
Internet Protocol Version 4, Src: 10.0.2.15, Dst: 142.251.209.142
Transmission Control Protocol, Src Port: 38310, Dst Port: 443, Seq: 0, Len: 0

No.     Time           Source                Destination           Protocol Length Info
      2 0.015713989    142.251.209.142       10.0.2.15             TCP      60     443 → 38310 [SYN, ACK] Seq=0 Ack=1 Win=65535 Len=0 MSS=1460

Frame 2: 60 bytes on wire (480 bits), 60 bytes captured (480 bits) on interface enp0s3, id 0
Ethernet II, Src: RealtekU_12:35:02 (52:54:00:12:35:02), Dst: PcsCompu_e2:fb:80 (08:00:27:e2:fb:80)
Internet Protocol Version 4, Src: 142.251.209.142, Dst: 10.0.2.15
Transmission Control Protocol, Src Port: 443, Dst Port: 38310, Seq: 0, Ack: 1, Len: 0

No.     Time           Source                Destination           Protocol Length Info
      3 0.015747882    10.0.2.15             142.251.209.142       TCP      54     38310 → 443 [ACK] Seq=1 Ack=1 Win=64240 Len=0

Frame 3: 54 bytes on wire (432 bits), 54 bytes captured (432 bits) on interface enp0s3, id 0
Ethernet II, Src: PcsCompu_e2:fb:80 (08:00:27:e2:fb:80), Dst: RealtekU_12:35:02 (52:54:00:12:35:02)
Internet Protocol Version 4, Src: 10.0.2.15, Dst: 142.251.209.142
Transmission Control Protocol, Src Port: 38310, Dst Port: 443, Seq: 1, Ack: 1, Len: 0

No.     Time           Source                Destination           Protocol Length Info
      4 0.025348581    10.0.2.15             142.251.209.142       TLSv1.3  571    Client Hello

Frame 4: 571 bytes on wire (4568 bits), 571 bytes captured (4568 bits) on interface enp0s3, id 0
Ethernet II, Src: PcsCompu_e2:fb:80 (08:00:27:e2:fb:80), Dst: RealtekU_12:35:02 (52:54:00:12:35:02)
Internet Protocol Version 4, Src: 10.0.2.15, Dst: 142.251.209.142
Transmission Control Protocol, Src Port: 38310, Dst Port: 443, Seq: 1, Ack: 1, Len: 517
Transport Layer Security

No.     Time           Source                Destination           Protocol Length Info
      5 0.025701676    142.251.209.142       10.0.2.15             TCP      60     443 → 38310 [ACK] Seq=1 Ack=518 Win=65535 Len=0

Frame 5: 60 bytes on wire (480 bits), 60 bytes captured (480 bits) on interface enp0s3, id 0
Ethernet II, Src: RealtekU_12:35:02 (52:54:00:12:35:02), Dst: PcsCompu_e2:fb:80 (08:00:27:e2:fb:80)
Internet Protocol Version 4, Src: 142.251.209.142, Dst: 10.0.2.15
Transmission Control Protocol, Src Port: 443, Dst Port: 38310, Seq: 1, Ack: 518, Len: 0

No.     Time           Source                Destination           Protocol Length Info
      6 0.044068798    142.251.209.142       10.0.2.15             TLSv1.3  2974   Server Hello, Change Cipher Spec

Frame 6: 2974 bytes on wire (23792 bits), 2974 bytes captured (23792 bits) on interface enp0s3, id 0
Ethernet II, Src: RealtekU_12:35:02 (52:54:00:12:35:02), Dst: PcsCompu_e2:fb:80 (08:00:27:e2:fb:80)
Internet Protocol Version 4, Src: 142.251.209.142, Dst: 10.0.2.15
Transmission Control Protocol, Src Port: 443, Dst Port: 38310, Seq: 1, Ack: 518, Len: 2920
Transport Layer Security

No.     Time           Source                Destination           Protocol Length Info
      7 0.044146194    10.0.2.15             142.251.209.142       TCP      54     38310 → 443 [ACK] Seq=518 Ack=2921 Win=62780 Len=0

Frame 7: 54 bytes on wire (432 bits), 54 bytes captured (432 bits) on interface enp0s3, id 0
Ethernet II, Src: PcsCompu_e2:fb:80 (08:00:27:e2:fb:80), Dst: RealtekU_12:35:02 (52:54:00:12:35:02)
Internet Protocol Version 4, Src: 10.0.2.15, Dst: 142.251.209.142
Transmission Control Protocol, Src Port: 38310, Dst Port: 443, Seq: 518, Ack: 2921, Len: 0

No.     Time           Source                Destination           Protocol Length Info
      8 0.044478862    142.251.209.142       10.0.2.15             TLSv1.3  3927   Encrypted Extensions, Certificate, Certificate Verify, Finished

Frame 8: 3927 bytes on wire (31416 bits), 3927 bytes captured (31416 bits) on interface enp0s3, id 0
Ethernet II, Src: RealtekU_12:35:02 (52:54:00:12:35:02), Dst: PcsCompu_e2:fb:80 (08:00:27:e2:fb:80)
Internet Protocol Version 4, Src: 142.251.209.142, Dst: 10.0.2.15
Transmission Control Protocol, Src Port: 443, Dst Port: 38310, Seq: 2921, Ack: 518, Len: 3873
[2 Reassembled TCP Segments (6660 bytes): #6(2787), #8(3873)]
Transport Layer Security

No.     Time           Source                Destination           Protocol Length Info
      9 0.044487937    10.0.2.15             142.251.209.142       TCP      54     38310 → 443 [ACK] Seq=518 Ack=6794 Win=59860 Len=0

Frame 9: 54 bytes on wire (432 bits), 54 bytes captured (432 bits) on interface enp0s3, id 0
Ethernet II, Src: PcsCompu_e2:fb:80 (08:00:27:e2:fb:80), Dst: RealtekU_12:35:02 (52:54:00:12:35:02)
Internet Protocol Version 4, Src: 10.0.2.15, Dst: 142.251.209.142
Transmission Control Protocol, Src Port: 38310, Dst Port: 443, Seq: 518, Ack: 6794, Len: 0

No.     Time           Source                Destination           Protocol Length Info
     10 0.648364286    10.0.2.15             142.251.209.142       TLSv1.3  134    Change Cipher Spec, Finished

Frame 10: 134 bytes on wire (1072 bits), 134 bytes captured (1072 bits) on interface enp0s3, id 0
Ethernet II, Src: PcsCompu_e2:fb:80 (08:00:27:e2:fb:80), Dst: RealtekU_12:35:02 (52:54:00:12:35:02)
Internet Protocol Version 4, Src: 10.0.2.15, Dst: 142.251.209.142
Transmission Control Protocol, Src Port: 38310, Dst Port: 443, Seq: 518, Ack: 6794, Len: 80
Transport Layer Security

No.     Time           Source                Destination           Protocol Length Info
     11 0.648706718    142.251.209.142       10.0.2.15             TCP      60     443 → 38310 [ACK] Seq=6794 Ack=598 Win=65535 Len=0

Frame 11: 60 bytes on wire (480 bits), 60 bytes captured (480 bits) on interface enp0s3, id 0
Ethernet II, Src: RealtekU_12:35:02 (52:54:00:12:35:02), Dst: PcsCompu_e2:fb:80 (08:00:27:e2:fb:80)
Internet Protocol Version 4, Src: 142.251.209.142, Dst: 10.0.2.15
Transmission Control Protocol, Src Port: 443, Dst Port: 38310, Seq: 6794, Ack: 598, Len: 0

No.     Time           Source                Destination           Protocol Length Info
     12 0.793789223    10.0.2.15             142.251.209.142       HTTP     387    GET / HTTP/1.1 

Frame 12: 387 bytes on wire (3096 bits), 387 bytes captured (3096 bits) on interface enp0s3, id 0
Ethernet II, Src: PcsCompu_e2:fb:80 (08:00:27:e2:fb:80), Dst: RealtekU_12:35:02 (52:54:00:12:35:02)
Internet Protocol Version 4, Src: 10.0.2.15, Dst: 142.251.209.142
Transmission Control Protocol, Src Port: 38310, Dst Port: 443, Seq: 598, Ack: 6794, Len: 333
Transport Layer Security
Hypertext Transfer Protocol
    GET / HTTP/1.1\r\n
    Host: youtube.com\r\n
    User-Agent: Mozilla/5.0 (Windows NT 10.0; rv:102.0) Gecko/20100101 Firefox/102.0\r\n
    Accept: text/html,application/xhtml+xml,application/xml;q=0.9,image/avif,image/webp,*/*;q=0.8\r\n
    Accept-Encoding: gzip, deflate\r\n
    Accept-Language: en-US,en;q=0.5\r\n
    DNT: 1\r\n
    Connection: keep-alive\r\n
    \r\n
    [Full request URI: https://youtube.com/]
    [HTTP request 1/1]
    [Response in frame: 14]

No.     Time           Source                Destination           Protocol Length Info
     13 0.794093438    142.251.209.142       10.0.2.15             TCP      60     443 → 38310 [ACK] Seq=6794 Ack=931 Win=65535 Len=0

Frame 13: 60 bytes on wire (480 bits), 60 bytes captured (480 bits) on interface enp0s3, id 0
Ethernet II, Src: RealtekU_12:35:02 (52:54:00:12:35:02), Dst: PcsCompu_e2:fb:80 (08:00:27:e2:fb:80)
Internet Protocol Version 4, Src: 142.251.209.142, Dst: 10.0.2.15
Transmission Control Protocol, Src Port: 443, Dst Port: 38310, Seq: 6794, Ack: 931, Len: 0

No.     Time           Source                Destination           Protocol Length Info
     14 0.821490525    142.251.209.142       10.0.2.15             HTTP     1996   HTTP/1.1 301 Moved Permanently 

Frame 14: 1996 bytes on wire (15968 bits), 1996 bytes captured (15968 bits) on interface enp0s3, id 0
Ethernet II, Src: RealtekU_12:35:02 (52:54:00:12:35:02), Dst: PcsCompu_e2:fb:80 (08:00:27:e2:fb:80)
Internet Protocol Version 4, Src: 142.251.209.142, Dst: 10.0.2.15
Transmission Control Protocol, Src Port: 443, Dst Port: 38310, Seq: 6794, Ack: 931, Len: 1942
Transport Layer Security
Hypertext Transfer Protocol
    HTTP/1.1 301 Moved Permanently\r\n
    Content-Type: application/binary\r\n
    X-Content-Type-Options: nosniff\r\n
    Expires: Wed, 16 Aug 2023 21:12:08 GMT\r\n
    Date: Wed, 16 Aug 2023 21:12:08 GMT\r\n
    Cache-Control: private, max-age=31536000\r\n
    Location: https://www.youtube.com/\r\n
    Strict-Transport-Security: max-age=31536000; includeSubDomains; preload\r\n
    X-Frame-Options: SAMEORIGIN\r\n
    Report-To: {"group":"youtube_main","max_age":2592000,"endpoints":[{"url":"https://csp.withgoogle.com/csp/report-to/youtube_main"}]}\r\n
    Permissions-Policy: ch-ua-arch=*, ch-ua-bitness=*, ch-ua-full-version=*, ch-ua-full-version-list=*, ch-ua-model=*, ch-ua-wow64=*, ch-ua-form-factor=*, ch-ua-platform=*, ch-ua-platform-version=*\r\n
    Cross-Origin-Opener-Policy: same-origin-allow-popups; report-to="youtube_main"\r\n
     [truncated]Origin-Trial: AvC9UlR6RDk2crliDsFl66RWLnTbHrDbp+DiY6AYz/PNQ4G4tdUTjrHYr2sghbkhGQAVxb7jaPTHpEVBz0uzQwkAAAB4eyJvcmlnaW4iOiJodHRwczovL3lvdXR1YmUuY29tOjQ0MyIsImZlYXR1cmUiOiJXZWJWaWV3WFJlcXVlc3RlZFdpdGhEZXByZWNhdGlvbiIsImV4cGlyeSI6
    Server: ESF\r\n
    Content-Length: 0\r\n
    X-XSS-Protection: 0\r\n
    Set-Cookie: CONSENT=PENDING+346; expires=Fri, 15-Aug-2025 21:12:08 GMT; path=/; domain=.youtube.com; Secure\r\n
    P3P: CP="This is not a P3P policy! See g.co/p3phelp for more info."\r\n
    Alt-Svc: h3=":443"; ma=2592000,h3-29=":443"; ma=2592000\r\n
    \r\n
    [HTTP response 1/1]
    [Time since request: 0.027701302 seconds]
    [Request in frame: 12]
    [Request URI: https://youtube.com/]

No.     Time           Source                Destination           Protocol Length Info
     15 0.821548921    10.0.2.15             142.251.209.142       TCP      54     38310 → 443 [ACK] Seq=931 Ack=8736 Win=62780 Len=0

Frame 15: 54 bytes on wire (432 bits), 54 bytes captured (432 bits) on interface enp0s3, id 0
Ethernet II, Src: PcsCompu_e2:fb:80 (08:00:27:e2:fb:80), Dst: RealtekU_12:35:02 (52:54:00:12:35:02)
Internet Protocol Version 4, Src: 10.0.2.15, Dst: 142.251.209.142
Transmission Control Protocol, Src Port: 38310, Dst Port: 443, Seq: 931, Ack: 8736, Len: 0

No.     Time           Source                Destination           Protocol Length Info
     16 0.876521145    10.0.2.15             142.251.209.142       TCP      54     38310 → 443 [FIN, ACK] Seq=931 Ack=8736 Win=62780 Len=0

Frame 16: 54 bytes on wire (432 bits), 54 bytes captured (432 bits) on interface enp0s3, id 0
Ethernet II, Src: PcsCompu_e2:fb:80 (08:00:27:e2:fb:80), Dst: RealtekU_12:35:02 (52:54:00:12:35:02)
Internet Protocol Version 4, Src: 10.0.2.15, Dst: 142.251.209.142
Transmission Control Protocol, Src Port: 38310, Dst Port: 443, Seq: 931, Ack: 8736, Len: 0

No.     Time           Source                Destination           Protocol Length Info
     17 0.876756310    142.251.209.142       10.0.2.15             TCP      60     443 → 38310 [ACK] Seq=8736 Ack=932 Win=65535 Len=0

Frame 17: 60 bytes on wire (480 bits), 60 bytes captured (480 bits) on interface enp0s3, id 0
Ethernet II, Src: RealtekU_12:35:02 (52:54:00:12:35:02), Dst: PcsCompu_e2:fb:80 (08:00:27:e2:fb:80)
Internet Protocol Version 4, Src: 142.251.209.142, Dst: 10.0.2.15
Transmission Control Protocol, Src Port: 443, Dst Port: 38310, Seq: 8736, Ack: 932, Len: 0

No.     Time           Source                Destination           Protocol Length Info
     18 0.894882918    142.251.209.142       10.0.2.15             TCP      60     443 → 38310 [FIN, ACK] Seq=8736 Ack=932 Win=65535 Len=0

Frame 18: 60 bytes on wire (480 bits), 60 bytes captured (480 bits) on interface enp0s3, id 0
Ethernet II, Src: RealtekU_12:35:02 (52:54:00:12:35:02), Dst: PcsCompu_e2:fb:80 (08:00:27:e2:fb:80)
Internet Protocol Version 4, Src: 142.251.209.142, Dst: 10.0.2.15
Transmission Control Protocol, Src Port: 443, Dst Port: 38310, Seq: 8736, Ack: 932, Len: 0

No.     Time           Source                Destination           Protocol Length Info
     19 0.894915677    10.0.2.15             142.251.209.142       TCP      54     38310 → 443 [ACK] Seq=932 Ack=8737 Win=62780 Len=0

Frame 19: 54 bytes on wire (432 bits), 54 bytes captured (432 bits) on interface enp0s3, id 0
Ethernet II, Src: PcsCompu_e2:fb:80 (08:00:27:e2:fb:80), Dst: RealtekU_12:35:02 (52:54:00:12:35:02)
Internet Protocol Version 4, Src: 10.0.2.15, Dst: 142.251.209.142
Transmission Control Protocol, Src Port: 38310, Dst Port: 443, Seq: 932, Ack: 8737, Len: 0

No.     Time           Source                Destination           Protocol Length Info
     20 3.662190005    10.0.2.15             142.251.209.142       TCP      74     38324 → 443 [SYN] Seq=0 Win=64240 Len=0 MSS=1460 SACK_PERM=1 TSval=2637102684 TSecr=0 WS=128

Frame 20: 74 bytes on wire (592 bits), 74 bytes captured (592 bits) on interface enp0s3, id 0
Ethernet II, Src: PcsCompu_e2:fb:80 (08:00:27:e2:fb:80), Dst: RealtekU_12:35:02 (52:54:00:12:35:02)
Internet Protocol Version 4, Src: 10.0.2.15, Dst: 142.251.209.142
Transmission Control Protocol, Src Port: 38324, Dst Port: 443, Seq: 0, Len: 0

No.     Time           Source                Destination           Protocol Length Info
     21 3.677010683    142.251.209.142       10.0.2.15             TCP      60     443 → 38324 [SYN, ACK] Seq=0 Ack=1 Win=65535 Len=0 MSS=1460

Frame 21: 60 bytes on wire (480 bits), 60 bytes captured (480 bits) on interface enp0s3, id 0
Ethernet II, Src: RealtekU_12:35:02 (52:54:00:12:35:02), Dst: PcsCompu_e2:fb:80 (08:00:27:e2:fb:80)
Internet Protocol Version 4, Src: 142.251.209.142, Dst: 10.0.2.15
Transmission Control Protocol, Src Port: 443, Dst Port: 38324, Seq: 0, Ack: 1, Len: 0

No.     Time           Source                Destination           Protocol Length Info
     22 3.677063535    10.0.2.15             142.251.209.142       TCP      54     38324 → 443 [ACK] Seq=1 Ack=1 Win=64240 Len=0

Frame 22: 54 bytes on wire (432 bits), 54 bytes captured (432 bits) on interface enp0s3, id 0
Ethernet II, Src: PcsCompu_e2:fb:80 (08:00:27:e2:fb:80), Dst: RealtekU_12:35:02 (52:54:00:12:35:02)
Internet Protocol Version 4, Src: 10.0.2.15, Dst: 142.251.209.142
Transmission Control Protocol, Src Port: 38324, Dst Port: 443, Seq: 1, Ack: 1, Len: 0

No.     Time           Source                Destination           Protocol Length Info
     23 4.008897476    10.0.2.15             142.251.209.142       TLSv1.3  571    Client Hello

Frame 23: 571 bytes on wire (4568 bits), 571 bytes captured (4568 bits) on interface enp0s3, id 0
Ethernet II, Src: PcsCompu_e2:fb:80 (08:00:27:e2:fb:80), Dst: RealtekU_12:35:02 (52:54:00:12:35:02)
Internet Protocol Version 4, Src: 10.0.2.15, Dst: 142.251.209.142
Transmission Control Protocol, Src Port: 38324, Dst Port: 443, Seq: 1, Ack: 1, Len: 517
Transport Layer Security

No.     Time           Source                Destination           Protocol Length Info
     24 4.009191898    142.251.209.142       10.0.2.15             TCP      60     443 → 38324 [ACK] Seq=1 Ack=518 Win=65535 Len=0

Frame 24: 60 bytes on wire (480 bits), 60 bytes captured (480 bits) on interface enp0s3, id 0
Ethernet II, Src: RealtekU_12:35:02 (52:54:00:12:35:02), Dst: PcsCompu_e2:fb:80 (08:00:27:e2:fb:80)
Internet Protocol Version 4, Src: 142.251.209.142, Dst: 10.0.2.15
Transmission Control Protocol, Src Port: 443, Dst Port: 38324, Seq: 1, Ack: 518, Len: 0

No.     Time           Source                Destination           Protocol Length Info
     25 4.024676164    142.251.209.142       10.0.2.15             TLSv1.3  2878   Server Hello, Change Cipher Spec

Frame 25: 2878 bytes on wire (23024 bits), 2878 bytes captured (23024 bits) on interface enp0s3, id 0
Ethernet II, Src: RealtekU_12:35:02 (52:54:00:12:35:02), Dst: PcsCompu_e2:fb:80 (08:00:27:e2:fb:80)
Internet Protocol Version 4, Src: 142.251.209.142, Dst: 10.0.2.15
Transmission Control Protocol, Src Port: 443, Dst Port: 38324, Seq: 1, Ack: 518, Len: 2824
Transport Layer Security

No.     Time           Source                Destination           Protocol Length Info
     26 4.024702946    10.0.2.15             142.251.209.142       TCP      54     38324 → 443 [ACK] Seq=518 Ack=2825 Win=62780 Len=0

Frame 26: 54 bytes on wire (432 bits), 54 bytes captured (432 bits) on interface enp0s3, id 0
Ethernet II, Src: PcsCompu_e2:fb:80 (08:00:27:e2:fb:80), Dst: RealtekU_12:35:02 (52:54:00:12:35:02)
Internet Protocol Version 4, Src: 10.0.2.15, Dst: 142.251.209.142
Transmission Control Protocol, Src Port: 38324, Dst Port: 443, Seq: 518, Ack: 2825, Len: 0

No.     Time           Source                Destination           Protocol Length Info
     27 4.024944802    142.251.209.142       10.0.2.15             TLSv1.3  4023   Encrypted Extensions, Certificate, Certificate Verify, Finished

Frame 27: 4023 bytes on wire (32184 bits), 4023 bytes captured (32184 bits) on interface enp0s3, id 0
Ethernet II, Src: RealtekU_12:35:02 (52:54:00:12:35:02), Dst: PcsCompu_e2:fb:80 (08:00:27:e2:fb:80)
Internet Protocol Version 4, Src: 142.251.209.142, Dst: 10.0.2.15
Transmission Control Protocol, Src Port: 443, Dst Port: 38324, Seq: 2825, Ack: 518, Len: 3969
[2 Reassembled TCP Segments (6660 bytes): #25(2691), #27(3969)]
Transport Layer Security

No.     Time           Source                Destination           Protocol Length Info
     28 4.024953927    10.0.2.15             142.251.209.142       TCP      54     38324 → 443 [ACK] Seq=518 Ack=6794 Win=59860 Len=0

Frame 28: 54 bytes on wire (432 bits), 54 bytes captured (432 bits) on interface enp0s3, id 0
Ethernet II, Src: PcsCompu_e2:fb:80 (08:00:27:e2:fb:80), Dst: RealtekU_12:35:02 (52:54:00:12:35:02)
Internet Protocol Version 4, Src: 10.0.2.15, Dst: 142.251.209.142
Transmission Control Protocol, Src Port: 38324, Dst Port: 443, Seq: 518, Ack: 6794, Len: 0

No.     Time           Source                Destination           Protocol Length Info
     29 4.164627033    10.0.2.15             142.251.209.142       TLSv1.3  134    Change Cipher Spec, Finished

Frame 29: 134 bytes on wire (1072 bits), 134 bytes captured (1072 bits) on interface enp0s3, id 0
Ethernet II, Src: PcsCompu_e2:fb:80 (08:00:27:e2:fb:80), Dst: RealtekU_12:35:02 (52:54:00:12:35:02)
Internet Protocol Version 4, Src: 10.0.2.15, Dst: 142.251.209.142
Transmission Control Protocol, Src Port: 38324, Dst Port: 443, Seq: 518, Ack: 6794, Len: 80
Transport Layer Security

No.     Time           Source                Destination           Protocol Length Info
     30 4.164908551    142.251.209.142       10.0.2.15             TCP      60     443 → 38324 [ACK] Seq=6794 Ack=598 Win=65535 Len=0

Frame 30: 60 bytes on wire (480 bits), 60 bytes captured (480 bits) on interface enp0s3, id 0
Ethernet II, Src: RealtekU_12:35:02 (52:54:00:12:35:02), Dst: PcsCompu_e2:fb:80 (08:00:27:e2:fb:80)
Internet Protocol Version 4, Src: 142.251.209.142, Dst: 10.0.2.15
Transmission Control Protocol, Src Port: 443, Dst Port: 38324, Seq: 6794, Ack: 598, Len: 0

No.     Time           Source                Destination           Protocol Length Info
     31 4.202542635    10.0.2.15             142.251.209.142       HTTP     387    GET / HTTP/1.1 

Frame 31: 387 bytes on wire (3096 bits), 387 bytes captured (3096 bits) on interface enp0s3, id 0
Ethernet II, Src: PcsCompu_e2:fb:80 (08:00:27:e2:fb:80), Dst: RealtekU_12:35:02 (52:54:00:12:35:02)
Internet Protocol Version 4, Src: 10.0.2.15, Dst: 142.251.209.142
Transmission Control Protocol, Src Port: 38324, Dst Port: 443, Seq: 598, Ack: 6794, Len: 333
Transport Layer Security
Hypertext Transfer Protocol
    GET / HTTP/1.1\r\n
    Host: youtube.com\r\n
    User-Agent: Mozilla/5.0 (Windows NT 10.0; rv:102.0) Gecko/20100101 Firefox/102.0\r\n
    Accept: text/html,application/xhtml+xml,application/xml;q=0.9,image/avif,image/webp,*/*;q=0.8\r\n
    Accept-Encoding: gzip, deflate\r\n
    Accept-Language: en-US,en;q=0.5\r\n
    DNT: 1\r\n
    Connection: keep-alive\r\n
    \r\n
    [Full request URI: https://youtube.com/]
    [HTTP request 1/1]
    [Response in frame: 33]

No.     Time           Source                Destination           Protocol Length Info
     32 4.202821112    142.251.209.142       10.0.2.15             TCP      60     443 → 38324 [ACK] Seq=6794 Ack=931 Win=65535 Len=0

Frame 32: 60 bytes on wire (480 bits), 60 bytes captured (480 bits) on interface enp0s3, id 0
Ethernet II, Src: RealtekU_12:35:02 (52:54:00:12:35:02), Dst: PcsCompu_e2:fb:80 (08:00:27:e2:fb:80)
Internet Protocol Version 4, Src: 142.251.209.142, Dst: 10.0.2.15
Transmission Control Protocol, Src Port: 443, Dst Port: 38324, Seq: 6794, Ack: 931, Len: 0

No.     Time           Source                Destination           Protocol Length Info
     33 4.232593657    142.251.209.142       10.0.2.15             HTTP     1996   HTTP/1.1 301 Moved Permanently 

Frame 33: 1996 bytes on wire (15968 bits), 1996 bytes captured (15968 bits) on interface enp0s3, id 0
Ethernet II, Src: RealtekU_12:35:02 (52:54:00:12:35:02), Dst: PcsCompu_e2:fb:80 (08:00:27:e2:fb:80)
Internet Protocol Version 4, Src: 142.251.209.142, Dst: 10.0.2.15
Transmission Control Protocol, Src Port: 443, Dst Port: 38324, Seq: 6794, Ack: 931, Len: 1942
Transport Layer Security
Hypertext Transfer Protocol
    HTTP/1.1 301 Moved Permanently\r\n
    Content-Type: application/binary\r\n
    X-Content-Type-Options: nosniff\r\n
    Expires: Wed, 16 Aug 2023 21:12:12 GMT\r\n
    Date: Wed, 16 Aug 2023 21:12:12 GMT\r\n
    Cache-Control: private, max-age=31536000\r\n
    Location: https://www.youtube.com/\r\n
    Strict-Transport-Security: max-age=31536000; includeSubDomains; preload\r\n
    X-Frame-Options: SAMEORIGIN\r\n
    Permissions-Policy: ch-ua-arch=*, ch-ua-bitness=*, ch-ua-full-version=*, ch-ua-full-version-list=*, ch-ua-model=*, ch-ua-wow64=*, ch-ua-form-factor=*, ch-ua-platform=*, ch-ua-platform-version=*\r\n
     [truncated]Origin-Trial: AvC9UlR6RDk2crliDsFl66RWLnTbHrDbp+DiY6AYz/PNQ4G4tdUTjrHYr2sghbkhGQAVxb7jaPTHpEVBz0uzQwkAAAB4eyJvcmlnaW4iOiJodHRwczovL3lvdXR1YmUuY29tOjQ0MyIsImZlYXR1cmUiOiJXZWJWaWV3WFJlcXVlc3RlZFdpdGhEZXByZWNhdGlvbiIsImV4cGlyeSI6
    Report-To: {"group":"youtube_main","max_age":2592000,"endpoints":[{"url":"https://csp.withgoogle.com/csp/report-to/youtube_main"}]}\r\n
    Cross-Origin-Opener-Policy: same-origin-allow-popups; report-to="youtube_main"\r\n
    Server: ESF\r\n
    Content-Length: 0\r\n
    X-XSS-Protection: 0\r\n
    Set-Cookie: CONSENT=PENDING+335; expires=Fri, 15-Aug-2025 21:12:12 GMT; path=/; domain=.youtube.com; Secure\r\n
    P3P: CP="This is not a P3P policy! See g.co/p3phelp for more info."\r\n
    Alt-Svc: h3=":443"; ma=2592000,h3-29=":443"; ma=2592000\r\n
    \r\n
    [HTTP response 1/1]
    [Time since request: 0.030051022 seconds]
    [Request in frame: 31]
    [Request URI: https://youtube.com/]

No.     Time           Source                Destination           Protocol Length Info
     34 4.232636727    10.0.2.15             142.251.209.142       TCP      54     38324 → 443 [ACK] Seq=931 Ack=8736 Win=62780 Len=0

Frame 34: 54 bytes on wire (432 bits), 54 bytes captured (432 bits) on interface enp0s3, id 0
Ethernet II, Src: PcsCompu_e2:fb:80 (08:00:27:e2:fb:80), Dst: RealtekU_12:35:02 (52:54:00:12:35:02)
Internet Protocol Version 4, Src: 10.0.2.15, Dst: 142.251.209.142
Transmission Control Protocol, Src Port: 38324, Dst Port: 443, Seq: 931, Ack: 8736, Len: 0

No.     Time           Source                Destination           Protocol Length Info
     35 4.315598968    10.0.2.15             142.251.209.142       TCP      54     38324 → 443 [FIN, ACK] Seq=931 Ack=8736 Win=62780 Len=0

Frame 35: 54 bytes on wire (432 bits), 54 bytes captured (432 bits) on interface enp0s3, id 0
Ethernet II, Src: PcsCompu_e2:fb:80 (08:00:27:e2:fb:80), Dst: RealtekU_12:35:02 (52:54:00:12:35:02)
Internet Protocol Version 4, Src: 10.0.2.15, Dst: 142.251.209.142
Transmission Control Protocol, Src Port: 38324, Dst Port: 443, Seq: 931, Ack: 8736, Len: 0

No.     Time           Source                Destination           Protocol Length Info
     36 4.315956105    142.251.209.142       10.0.2.15             TCP      60     443 → 38324 [ACK] Seq=8736 Ack=932 Win=65535 Len=0

Frame 36: 60 bytes on wire (480 bits), 60 bytes captured (480 bits) on interface enp0s3, id 0
Ethernet II, Src: RealtekU_12:35:02 (52:54:00:12:35:02), Dst: PcsCompu_e2:fb:80 (08:00:27:e2:fb:80)
Internet Protocol Version 4, Src: 142.251.209.142, Dst: 10.0.2.15
Transmission Control Protocol, Src Port: 443, Dst Port: 38324, Seq: 8736, Ack: 932, Len: 0

No.     Time           Source                Destination           Protocol Length Info
     37 4.328665050    142.251.209.142       10.0.2.15             TCP      60     443 → 38324 [FIN, ACK] Seq=8736 Ack=932 Win=65535 Len=0

Frame 37: 60 bytes on wire (480 bits), 60 bytes captured (480 bits) on interface enp0s3, id 0
Ethernet II, Src: RealtekU_12:35:02 (52:54:00:12:35:02), Dst: PcsCompu_e2:fb:80 (08:00:27:e2:fb:80)
Internet Protocol Version 4, Src: 142.251.209.142, Dst: 10.0.2.15
Transmission Control Protocol, Src Port: 443, Dst Port: 38324, Seq: 8736, Ack: 932, Len: 0

No.     Time           Source                Destination           Protocol Length Info
     38 4.328696741    10.0.2.15             142.251.209.142       TCP      54     38324 → 443 [ACK] Seq=932 Ack=8737 Win=62780 Len=0

Frame 38: 54 bytes on wire (432 bits), 54 bytes captured (432 bits) on interface enp0s3, id 0
Ethernet II, Src: PcsCompu_e2:fb:80 (08:00:27:e2:fb:80), Dst: RealtekU_12:35:02 (52:54:00:12:35:02)
Internet Protocol Version 4, Src: 10.0.2.15, Dst: 142.251.209.142
Transmission Control Protocol, Src Port: 38324, Dst Port: 443, Seq: 932, Ack: 8737, Len: 0

No.     Time           Source                Destination           Protocol Length Info
     39 7.293698271    10.0.2.15             142.251.209.142       TCP      74     50552 → 443 [SYN] Seq=0 Win=64240 Len=0 MSS=1460 SACK_PERM=1 TSval=2637106316 TSecr=0 WS=128

Frame 39: 74 bytes on wire (592 bits), 74 bytes captured (592 bits) on interface enp0s3, id 0
Ethernet II, Src: PcsCompu_e2:fb:80 (08:00:27:e2:fb:80), Dst: RealtekU_12:35:02 (52:54:00:12:35:02)
Internet Protocol Version 4, Src: 10.0.2.15, Dst: 142.251.209.142
Transmission Control Protocol, Src Port: 50552, Dst Port: 443, Seq: 0, Len: 0

No.     Time           Source                Destination           Protocol Length Info
     40 7.314152589    142.251.209.142       10.0.2.15             TCP      60     443 → 50552 [SYN, ACK] Seq=0 Ack=1 Win=65535 Len=0 MSS=1460

Frame 40: 60 bytes on wire (480 bits), 60 bytes captured (480 bits) on interface enp0s3, id 0
Ethernet II, Src: RealtekU_12:35:02 (52:54:00:12:35:02), Dst: PcsCompu_e2:fb:80 (08:00:27:e2:fb:80)
Internet Protocol Version 4, Src: 142.251.209.142, Dst: 10.0.2.15
Transmission Control Protocol, Src Port: 443, Dst Port: 50552, Seq: 0, Ack: 1, Len: 0

No.     Time           Source                Destination           Protocol Length Info
     41 7.314188909    10.0.2.15             142.251.209.142       TCP      54     50552 → 443 [ACK] Seq=1 Ack=1 Win=64240 Len=0

Frame 41: 54 bytes on wire (432 bits), 54 bytes captured (432 bits) on interface enp0s3, id 0
Ethernet II, Src: PcsCompu_e2:fb:80 (08:00:27:e2:fb:80), Dst: RealtekU_12:35:02 (52:54:00:12:35:02)
Internet Protocol Version 4, Src: 10.0.2.15, Dst: 142.251.209.142
Transmission Control Protocol, Src Port: 50552, Dst Port: 443, Seq: 1, Ack: 1, Len: 0

No.     Time           Source                Destination           Protocol Length Info
     42 7.335553507    10.0.2.15             142.251.209.142       TLSv1.3  571    Client Hello

Frame 42: 571 bytes on wire (4568 bits), 571 bytes captured (4568 bits) on interface enp0s3, id 0
Ethernet II, Src: PcsCompu_e2:fb:80 (08:00:27:e2:fb:80), Dst: RealtekU_12:35:02 (52:54:00:12:35:02)
Internet Protocol Version 4, Src: 10.0.2.15, Dst: 142.251.209.142
Transmission Control Protocol, Src Port: 50552, Dst Port: 443, Seq: 1, Ack: 1, Len: 517
Transport Layer Security

No.     Time           Source                Destination           Protocol Length Info
     43 7.336032853    142.251.209.142       10.0.2.15             TCP      60     443 → 50552 [ACK] Seq=1 Ack=518 Win=65535 Len=0

Frame 43: 60 bytes on wire (480 bits), 60 bytes captured (480 bits) on interface enp0s3, id 0
Ethernet II, Src: RealtekU_12:35:02 (52:54:00:12:35:02), Dst: PcsCompu_e2:fb:80 (08:00:27:e2:fb:80)
Internet Protocol Version 4, Src: 142.251.209.142, Dst: 10.0.2.15
Transmission Control Protocol, Src Port: 443, Dst Port: 50552, Seq: 1, Ack: 518, Len: 0

No.     Time           Source                Destination           Protocol Length Info
     44 7.351902266    142.251.209.142       10.0.2.15             TLSv1.3  2974   Server Hello, Change Cipher Spec

Frame 44: 2974 bytes on wire (23792 bits), 2974 bytes captured (23792 bits) on interface enp0s3, id 0
Ethernet II, Src: RealtekU_12:35:02 (52:54:00:12:35:02), Dst: PcsCompu_e2:fb:80 (08:00:27:e2:fb:80)
Internet Protocol Version 4, Src: 142.251.209.142, Dst: 10.0.2.15
Transmission Control Protocol, Src Port: 443, Dst Port: 50552, Seq: 1, Ack: 518, Len: 2920
Transport Layer Security

No.     Time           Source                Destination           Protocol Length Info
     45 7.351958138    10.0.2.15             142.251.209.142       TCP      54     50552 → 443 [ACK] Seq=518 Ack=2921 Win=62780 Len=0

Frame 45: 54 bytes on wire (432 bits), 54 bytes captured (432 bits) on interface enp0s3, id 0
Ethernet II, Src: PcsCompu_e2:fb:80 (08:00:27:e2:fb:80), Dst: RealtekU_12:35:02 (52:54:00:12:35:02)
Internet Protocol Version 4, Src: 10.0.2.15, Dst: 142.251.209.142
Transmission Control Protocol, Src Port: 50552, Dst Port: 443, Seq: 518, Ack: 2921, Len: 0

No.     Time           Source                Destination           Protocol Length Info
     46 7.352248032    142.251.209.142       10.0.2.15             TLSv1.3  3928   Encrypted Extensions, Certificate, Certificate Verify, Finished

Frame 46: 3928 bytes on wire (31424 bits), 3928 bytes captured (31424 bits) on interface enp0s3, id 0
Ethernet II, Src: RealtekU_12:35:02 (52:54:00:12:35:02), Dst: PcsCompu_e2:fb:80 (08:00:27:e2:fb:80)
Internet Protocol Version 4, Src: 142.251.209.142, Dst: 10.0.2.15
Transmission Control Protocol, Src Port: 443, Dst Port: 50552, Seq: 2921, Ack: 518, Len: 3874
[2 Reassembled TCP Segments (6661 bytes): #44(2787), #46(3874)]
Transport Layer Security

No.     Time           Source                Destination           Protocol Length Info
     47 7.352257654    10.0.2.15             142.251.209.142       TCP      54     50552 → 443 [ACK] Seq=518 Ack=6795 Win=59860 Len=0

Frame 47: 54 bytes on wire (432 bits), 54 bytes captured (432 bits) on interface enp0s3, id 0
Ethernet II, Src: PcsCompu_e2:fb:80 (08:00:27:e2:fb:80), Dst: RealtekU_12:35:02 (52:54:00:12:35:02)
Internet Protocol Version 4, Src: 10.0.2.15, Dst: 142.251.209.142
Transmission Control Protocol, Src Port: 50552, Dst Port: 443, Seq: 518, Ack: 6795, Len: 0

No.     Time           Source                Destination           Protocol Length Info
     48 7.492935242    10.0.2.15             142.251.209.142       TLSv1.3  134    Change Cipher Spec, Finished

Frame 48: 134 bytes on wire (1072 bits), 134 bytes captured (1072 bits) on interface enp0s3, id 0
Ethernet II, Src: PcsCompu_e2:fb:80 (08:00:27:e2:fb:80), Dst: RealtekU_12:35:02 (52:54:00:12:35:02)
Internet Protocol Version 4, Src: 10.0.2.15, Dst: 142.251.209.142
Transmission Control Protocol, Src Port: 50552, Dst Port: 443, Seq: 518, Ack: 6795, Len: 80
Transport Layer Security

No.     Time           Source                Destination           Protocol Length Info
     49 7.493254543    142.251.209.142       10.0.2.15             TCP      60     443 → 50552 [ACK] Seq=6795 Ack=598 Win=65535 Len=0

Frame 49: 60 bytes on wire (480 bits), 60 bytes captured (480 bits) on interface enp0s3, id 0
Ethernet II, Src: RealtekU_12:35:02 (52:54:00:12:35:02), Dst: PcsCompu_e2:fb:80 (08:00:27:e2:fb:80)
Internet Protocol Version 4, Src: 142.251.209.142, Dst: 10.0.2.15
Transmission Control Protocol, Src Port: 443, Dst Port: 50552, Seq: 6795, Ack: 598, Len: 0

No.     Time           Source                Destination           Protocol Length Info
     50 23.032734970   10.0.2.15             142.251.209.142       HTTP     387    GET / HTTP/1.1 

Frame 50: 387 bytes on wire (3096 bits), 387 bytes captured (3096 bits) on interface enp0s3, id 0
Ethernet II, Src: PcsCompu_e2:fb:80 (08:00:27:e2:fb:80), Dst: RealtekU_12:35:02 (52:54:00:12:35:02)
Internet Protocol Version 4, Src: 10.0.2.15, Dst: 142.251.209.142
Transmission Control Protocol, Src Port: 50552, Dst Port: 443, Seq: 598, Ack: 6795, Len: 333
Transport Layer Security
Hypertext Transfer Protocol
    GET / HTTP/1.1\r\n
    Host: youtube.com\r\n
    User-Agent: Mozilla/5.0 (Windows NT 10.0; rv:102.0) Gecko/20100101 Firefox/102.0\r\n
    Accept: text/html,application/xhtml+xml,application/xml;q=0.9,image/avif,image/webp,*/*;q=0.8\r\n
    Accept-Encoding: gzip, deflate\r\n
    Accept-Language: en-US,en;q=0.5\r\n
    DNT: 1\r\n
    Connection: keep-alive\r\n
    \r\n
    [Full request URI: https://youtube.com/]
    [HTTP request 1/1]
    [Response in frame: 52]

No.     Time           Source                Destination           Protocol Length Info
     51 23.033674435   142.251.209.142       10.0.2.15             TCP      60     443 → 50552 [ACK] Seq=6795 Ack=931 Win=65535 Len=0

Frame 51: 60 bytes on wire (480 bits), 60 bytes captured (480 bits) on interface enp0s3, id 0
Ethernet II, Src: RealtekU_12:35:02 (52:54:00:12:35:02), Dst: PcsCompu_e2:fb:80 (08:00:27:e2:fb:80)
Internet Protocol Version 4, Src: 142.251.209.142, Dst: 10.0.2.15
Transmission Control Protocol, Src Port: 443, Dst Port: 50552, Seq: 6795, Ack: 931, Len: 0

No.     Time           Source                Destination           Protocol Length Info
     52 23.063150423   142.251.209.142       10.0.2.15             HTTP     2008   HTTP/1.1 301 Moved Permanently 

Frame 52: 2008 bytes on wire (16064 bits), 2008 bytes captured (16064 bits) on interface enp0s3, id 0
Ethernet II, Src: RealtekU_12:35:02 (52:54:00:12:35:02), Dst: PcsCompu_e2:fb:80 (08:00:27:e2:fb:80)
Internet Protocol Version 4, Src: 142.251.209.142, Dst: 10.0.2.15
Transmission Control Protocol, Src Port: 443, Dst Port: 50552, Seq: 6795, Ack: 931, Len: 1954
Transport Layer Security
Hypertext Transfer Protocol
    HTTP/1.1 301 Moved Permanently\r\n
    Content-Type: application/binary\r\n
    X-Content-Type-Options: nosniff\r\n
    Expires: Wed, 16 Aug 2023 21:12:30 GMT\r\n
    Date: Wed, 16 Aug 2023 21:12:30 GMT\r\n
    Cache-Control: private, max-age=31536000\r\n
    Location: https://www.youtube.com/\r\n
    Strict-Transport-Security: max-age=31536000; includeSubDomains; preload\r\n
    X-Frame-Options: SAMEORIGIN\r\n
    Cross-Origin-Opener-Policy-Report-Only: same-origin-allow-popups; report-to="youtube_main"\r\n
    Permissions-Policy: ch-ua-arch=*, ch-ua-bitness=*, ch-ua-full-version=*, ch-ua-full-version-list=*, ch-ua-model=*, ch-ua-wow64=*, ch-ua-form-factor=*, ch-ua-platform=*, ch-ua-platform-version=*\r\n
     [truncated]Origin-Trial: AvC9UlR6RDk2crliDsFl66RWLnTbHrDbp+DiY6AYz/PNQ4G4tdUTjrHYr2sghbkhGQAVxb7jaPTHpEVBz0uzQwkAAAB4eyJvcmlnaW4iOiJodHRwczovL3lvdXR1YmUuY29tOjQ0MyIsImZlYXR1cmUiOiJXZWJWaWV3WFJlcXVlc3RlZFdpdGhEZXByZWNhdGlvbiIsImV4cGlyeSI6
    Report-To: {"group":"youtube_main","max_age":2592000,"endpoints":[{"url":"https://csp.withgoogle.com/csp/report-to/youtube_main"}]}\r\n
    Server: ESF\r\n
    Content-Length: 0\r\n
    X-XSS-Protection: 0\r\n
    Set-Cookie: CONSENT=PENDING+647; expires=Fri, 15-Aug-2025 21:12:30 GMT; path=/; domain=.youtube.com; Secure\r\n
    P3P: CP="This is not a P3P policy! See g.co/p3phelp for more info."\r\n
    Alt-Svc: h3=":443"; ma=2592000,h3-29=":443"; ma=2592000\r\n
    \r\n
    [HTTP response 1/1]
    [Time since request: 0.030415453 seconds]
    [Request in frame: 50]
    [Request URI: https://youtube.com/]

No.     Time           Source                Destination           Protocol Length Info
     53 23.063228649   10.0.2.15             142.251.209.142       TCP      54     50552 → 443 [ACK] Seq=931 Ack=8749 Win=62780 Len=0

Frame 53: 54 bytes on wire (432 bits), 54 bytes captured (432 bits) on interface enp0s3, id 0
Ethernet II, Src: PcsCompu_e2:fb:80 (08:00:27:e2:fb:80), Dst: RealtekU_12:35:02 (52:54:00:12:35:02)
Internet Protocol Version 4, Src: 10.0.2.15, Dst: 142.251.209.142
Transmission Control Protocol, Src Port: 50552, Dst Port: 443, Seq: 931, Ack: 8749, Len: 0

No.     Time           Source                Destination           Protocol Length Info
     54 23.095442725   10.0.2.15             142.251.209.142       TCP      54     50552 → 443 [FIN, ACK] Seq=931 Ack=8749 Win=62780 Len=0

Frame 54: 54 bytes on wire (432 bits), 54 bytes captured (432 bits) on interface enp0s3, id 0
Ethernet II, Src: PcsCompu_e2:fb:80 (08:00:27:e2:fb:80), Dst: RealtekU_12:35:02 (52:54:00:12:35:02)
Internet Protocol Version 4, Src: 10.0.2.15, Dst: 142.251.209.142
Transmission Control Protocol, Src Port: 50552, Dst Port: 443, Seq: 931, Ack: 8749, Len: 0

No.     Time           Source                Destination           Protocol Length Info
     55 23.103180808   142.251.209.142       10.0.2.15             TCP      60     443 → 50552 [ACK] Seq=8749 Ack=932 Win=65535 Len=0

Frame 55: 60 bytes on wire (480 bits), 60 bytes captured (480 bits) on interface enp0s3, id 0
Ethernet II, Src: RealtekU_12:35:02 (52:54:00:12:35:02), Dst: PcsCompu_e2:fb:80 (08:00:27:e2:fb:80)
Internet Protocol Version 4, Src: 142.251.209.142, Dst: 10.0.2.15
Transmission Control Protocol, Src Port: 443, Dst Port: 50552, Seq: 8749, Ack: 932, Len: 0

No.     Time           Source                Destination           Protocol Length Info
     56 23.119702837   142.251.209.142       10.0.2.15             TCP      60     443 → 50552 [FIN, ACK] Seq=8749 Ack=932 Win=65535 Len=0

Frame 56: 60 bytes on wire (480 bits), 60 bytes captured (480 bits) on interface enp0s3, id 0
Ethernet II, Src: RealtekU_12:35:02 (52:54:00:12:35:02), Dst: PcsCompu_e2:fb:80 (08:00:27:e2:fb:80)
Internet Protocol Version 4, Src: 142.251.209.142, Dst: 10.0.2.15
Transmission Control Protocol, Src Port: 443, Dst Port: 50552, Seq: 8749, Ack: 932, Len: 0

No.     Time           Source                Destination           Protocol Length Info
     57 23.119731970   10.0.2.15             142.251.209.142       TCP      54     50552 → 443 [ACK] Seq=932 Ack=8750 Win=62780 Len=0

Frame 57: 54 bytes on wire (432 bits), 54 bytes captured (432 bits) on interface enp0s3, id 0
Ethernet II, Src: PcsCompu_e2:fb:80 (08:00:27:e2:fb:80), Dst: RealtekU_12:35:02 (52:54:00:12:35:02)
Internet Protocol Version 4, Src: 10.0.2.15, Dst: 142.251.209.142
Transmission Control Protocol, Src Port: 50552, Dst Port: 443, Seq: 932, Ack: 8750, Len: 0

No.     Time           Source                Destination           Protocol Length Info
     58 97.126640640   10.0.2.15             142.251.209.142       TCP      74     40538 → 443 [SYN] Seq=0 Win=64240 Len=0 MSS=1460 SACK_PERM=1 TSval=2637196149 TSecr=0 WS=128

Frame 58: 74 bytes on wire (592 bits), 74 bytes captured (592 bits) on interface enp0s3, id 0
Ethernet II, Src: PcsCompu_e2:fb:80 (08:00:27:e2:fb:80), Dst: RealtekU_12:35:02 (52:54:00:12:35:02)
Internet Protocol Version 4, Src: 10.0.2.15, Dst: 142.251.209.142
Transmission Control Protocol, Src Port: 40538, Dst Port: 443, Seq: 0, Len: 0

No.     Time           Source                Destination           Protocol Length Info
     59 97.141602288   142.251.209.142       10.0.2.15             TCP      60     443 → 40538 [SYN, ACK] Seq=0 Ack=1 Win=65535 Len=0 MSS=1460

Frame 59: 60 bytes on wire (480 bits), 60 bytes captured (480 bits) on interface enp0s3, id 0
Ethernet II, Src: RealtekU_12:35:02 (52:54:00:12:35:02), Dst: PcsCompu_e2:fb:80 (08:00:27:e2:fb:80)
Internet Protocol Version 4, Src: 142.251.209.142, Dst: 10.0.2.15
Transmission Control Protocol, Src Port: 443, Dst Port: 40538, Seq: 0, Ack: 1, Len: 0

No.     Time           Source                Destination           Protocol Length Info
     60 97.141689115   10.0.2.15             142.251.209.142       TCP      54     40538 → 443 [ACK] Seq=1 Ack=1 Win=64240 Len=0

Frame 60: 54 bytes on wire (432 bits), 54 bytes captured (432 bits) on interface enp0s3, id 0
Ethernet II, Src: PcsCompu_e2:fb:80 (08:00:27:e2:fb:80), Dst: RealtekU_12:35:02 (52:54:00:12:35:02)
Internet Protocol Version 4, Src: 10.0.2.15, Dst: 142.251.209.142
Transmission Control Protocol, Src Port: 40538, Dst Port: 443, Seq: 1, Ack: 1, Len: 0

No.     Time           Source                Destination           Protocol Length Info
     61 97.155191691   10.0.2.15             142.251.209.142       TLSv1.3  571    Client Hello

Frame 61: 571 bytes on wire (4568 bits), 571 bytes captured (4568 bits) on interface enp0s3, id 0
Ethernet II, Src: PcsCompu_e2:fb:80 (08:00:27:e2:fb:80), Dst: RealtekU_12:35:02 (52:54:00:12:35:02)
Internet Protocol Version 4, Src: 10.0.2.15, Dst: 142.251.209.142
Transmission Control Protocol, Src Port: 40538, Dst Port: 443, Seq: 1, Ack: 1, Len: 517
Transport Layer Security

No.     Time           Source                Destination           Protocol Length Info
     62 97.155552781   142.251.209.142       10.0.2.15             TCP      60     443 → 40538 [ACK] Seq=1 Ack=518 Win=65535 Len=0

Frame 62: 60 bytes on wire (480 bits), 60 bytes captured (480 bits) on interface enp0s3, id 0
Ethernet II, Src: RealtekU_12:35:02 (52:54:00:12:35:02), Dst: PcsCompu_e2:fb:80 (08:00:27:e2:fb:80)
Internet Protocol Version 4, Src: 142.251.209.142, Dst: 10.0.2.15
Transmission Control Protocol, Src Port: 443, Dst Port: 40538, Seq: 1, Ack: 518, Len: 0

No.     Time           Source                Destination           Protocol Length Info
     63 97.171639116   142.251.209.142       10.0.2.15             TLSv1.3  2974   Server Hello, Change Cipher Spec

Frame 63: 2974 bytes on wire (23792 bits), 2974 bytes captured (23792 bits) on interface enp0s3, id 0
Ethernet II, Src: RealtekU_12:35:02 (52:54:00:12:35:02), Dst: PcsCompu_e2:fb:80 (08:00:27:e2:fb:80)
Internet Protocol Version 4, Src: 142.251.209.142, Dst: 10.0.2.15
Transmission Control Protocol, Src Port: 443, Dst Port: 40538, Seq: 1, Ack: 518, Len: 2920
Transport Layer Security

No.     Time           Source                Destination           Protocol Length Info
     64 97.171678209   10.0.2.15             142.251.209.142       TCP      54     40538 → 443 [ACK] Seq=518 Ack=2921 Win=62780 Len=0

Frame 64: 54 bytes on wire (432 bits), 54 bytes captured (432 bits) on interface enp0s3, id 0
Ethernet II, Src: PcsCompu_e2:fb:80 (08:00:27:e2:fb:80), Dst: RealtekU_12:35:02 (52:54:00:12:35:02)
Internet Protocol Version 4, Src: 10.0.2.15, Dst: 142.251.209.142
Transmission Control Protocol, Src Port: 40538, Dst Port: 443, Seq: 518, Ack: 2921, Len: 0

No.     Time           Source                Destination           Protocol Length Info
     65 97.171999686   142.251.209.142       10.0.2.15             TLSv1.3  3927   Encrypted Extensions, Certificate, Certificate Verify, Finished

Frame 65: 3927 bytes on wire (31416 bits), 3927 bytes captured (31416 bits) on interface enp0s3, id 0
Ethernet II, Src: RealtekU_12:35:02 (52:54:00:12:35:02), Dst: PcsCompu_e2:fb:80 (08:00:27:e2:fb:80)
Internet Protocol Version 4, Src: 142.251.209.142, Dst: 10.0.2.15
Transmission Control Protocol, Src Port: 443, Dst Port: 40538, Seq: 2921, Ack: 518, Len: 3873
[2 Reassembled TCP Segments (6660 bytes): #63(2787), #65(3873)]
Transport Layer Security

No.     Time           Source                Destination           Protocol Length Info
     66 97.172011775   10.0.2.15             142.251.209.142       TCP      54     40538 → 443 [ACK] Seq=518 Ack=6794 Win=59860 Len=0

Frame 66: 54 bytes on wire (432 bits), 54 bytes captured (432 bits) on interface enp0s3, id 0
Ethernet II, Src: PcsCompu_e2:fb:80 (08:00:27:e2:fb:80), Dst: RealtekU_12:35:02 (52:54:00:12:35:02)
Internet Protocol Version 4, Src: 10.0.2.15, Dst: 142.251.209.142
Transmission Control Protocol, Src Port: 40538, Dst Port: 443, Seq: 518, Ack: 6794, Len: 0

No.     Time           Source                Destination           Protocol Length Info
     67 97.259573074   10.0.2.15             142.251.209.142       TLSv1.3  134    Change Cipher Spec, Finished

Frame 67: 134 bytes on wire (1072 bits), 134 bytes captured (1072 bits) on interface enp0s3, id 0
Ethernet II, Src: PcsCompu_e2:fb:80 (08:00:27:e2:fb:80), Dst: RealtekU_12:35:02 (52:54:00:12:35:02)
Internet Protocol Version 4, Src: 10.0.2.15, Dst: 142.251.209.142
Transmission Control Protocol, Src Port: 40538, Dst Port: 443, Seq: 518, Ack: 6794, Len: 80
Transport Layer Security

No.     Time           Source                Destination           Protocol Length Info
     68 97.259947501   142.251.209.142       10.0.2.15             TCP      60     443 → 40538 [ACK] Seq=6794 Ack=598 Win=65535 Len=0

Frame 68: 60 bytes on wire (480 bits), 60 bytes captured (480 bits) on interface enp0s3, id 0
Ethernet II, Src: RealtekU_12:35:02 (52:54:00:12:35:02), Dst: PcsCompu_e2:fb:80 (08:00:27:e2:fb:80)
Internet Protocol Version 4, Src: 142.251.209.142, Dst: 10.0.2.15
Transmission Control Protocol, Src Port: 443, Dst Port: 40538, Seq: 6794, Ack: 598, Len: 0

No.     Time           Source                Destination           Protocol Length Info
     69 97.293660658   10.0.2.15             142.251.209.142       HTTP     387    GET / HTTP/1.1 

Frame 69: 387 bytes on wire (3096 bits), 387 bytes captured (3096 bits) on interface enp0s3, id 0
Ethernet II, Src: PcsCompu_e2:fb:80 (08:00:27:e2:fb:80), Dst: RealtekU_12:35:02 (52:54:00:12:35:02)
Internet Protocol Version 4, Src: 10.0.2.15, Dst: 142.251.209.142
Transmission Control Protocol, Src Port: 40538, Dst Port: 443, Seq: 598, Ack: 6794, Len: 333
Transport Layer Security
Hypertext Transfer Protocol
    GET / HTTP/1.1\r\n
    Host: youtube.com\r\n
    User-Agent: Mozilla/5.0 (Windows NT 10.0; rv:102.0) Gecko/20100101 Firefox/102.0\r\n
    Accept: text/html,application/xhtml+xml,application/xml;q=0.9,image/avif,image/webp,*/*;q=0.8\r\n
    Accept-Encoding: gzip, deflate\r\n
    Accept-Language: en-US,en;q=0.5\r\n
    DNT: 1\r\n
    Connection: keep-alive\r\n
    \r\n
    [Full request URI: https://youtube.com/]
    [HTTP request 1/1]
    [Response in frame: 71]

No.     Time           Source                Destination           Protocol Length Info
     70 97.294114122   142.251.209.142       10.0.2.15             TCP      60     443 → 40538 [ACK] Seq=6794 Ack=931 Win=65535 Len=0

Frame 70: 60 bytes on wire (480 bits), 60 bytes captured (480 bits) on interface enp0s3, id 0
Ethernet II, Src: RealtekU_12:35:02 (52:54:00:12:35:02), Dst: PcsCompu_e2:fb:80 (08:00:27:e2:fb:80)
Internet Protocol Version 4, Src: 142.251.209.142, Dst: 10.0.2.15
Transmission Control Protocol, Src Port: 443, Dst Port: 40538, Seq: 6794, Ack: 931, Len: 0

No.     Time           Source                Destination           Protocol Length Info
     71 97.320027414   142.251.209.142       10.0.2.15             HTTP     1996   HTTP/1.1 301 Moved Permanently 

Frame 71: 1996 bytes on wire (15968 bits), 1996 bytes captured (15968 bits) on interface enp0s3, id 0
Ethernet II, Src: RealtekU_12:35:02 (52:54:00:12:35:02), Dst: PcsCompu_e2:fb:80 (08:00:27:e2:fb:80)
Internet Protocol Version 4, Src: 142.251.209.142, Dst: 10.0.2.15
Transmission Control Protocol, Src Port: 443, Dst Port: 40538, Seq: 6794, Ack: 931, Len: 1942
Transport Layer Security
Hypertext Transfer Protocol
    HTTP/1.1 301 Moved Permanently\r\n
    Content-Type: application/binary\r\n
    X-Content-Type-Options: nosniff\r\n
    Expires: Wed, 16 Aug 2023 21:13:45 GMT\r\n
    Date: Wed, 16 Aug 2023 21:13:45 GMT\r\n
    Cache-Control: private, max-age=31536000\r\n
    Location: https://www.youtube.com/\r\n
    Strict-Transport-Security: max-age=31536000; includeSubDomains; preload\r\n
    X-Frame-Options: SAMEORIGIN\r\n
    Report-To: {"group":"youtube_main","max_age":2592000,"endpoints":[{"url":"https://csp.withgoogle.com/csp/report-to/youtube_main"}]}\r\n
    Permissions-Policy: ch-ua-arch=*, ch-ua-bitness=*, ch-ua-full-version=*, ch-ua-full-version-list=*, ch-ua-model=*, ch-ua-wow64=*, ch-ua-form-factor=*, ch-ua-platform=*, ch-ua-platform-version=*\r\n
     [truncated]Origin-Trial: AvC9UlR6RDk2crliDsFl66RWLnTbHrDbp+DiY6AYz/PNQ4G4tdUTjrHYr2sghbkhGQAVxb7jaPTHpEVBz0uzQwkAAAB4eyJvcmlnaW4iOiJodHRwczovL3lvdXR1YmUuY29tOjQ0MyIsImZlYXR1cmUiOiJXZWJWaWV3WFJlcXVlc3RlZFdpdGhEZXByZWNhdGlvbiIsImV4cGlyeSI6
    Cross-Origin-Opener-Policy: same-origin-allow-popups; report-to="youtube_main"\r\n
    Server: ESF\r\n
    Content-Length: 0\r\n
    X-XSS-Protection: 0\r\n
    Set-Cookie: CONSENT=PENDING+794; expires=Fri, 15-Aug-2025 21:13:45 GMT; path=/; domain=.youtube.com; Secure\r\n
    P3P: CP="This is not a P3P policy! See g.co/p3phelp for more info."\r\n
    Alt-Svc: h3=":443"; ma=2592000,h3-29=":443"; ma=2592000\r\n
    \r\n
    [HTTP response 1/1]
    [Time since request: 0.026366756 seconds]
    [Request in frame: 69]
    [Request URI: https://youtube.com/]

No.     Time           Source                Destination           Protocol Length Info
     72 97.320053844   10.0.2.15             142.251.209.142       TCP      54     40538 → 443 [ACK] Seq=931 Ack=8736 Win=62780 Len=0

Frame 72: 54 bytes on wire (432 bits), 54 bytes captured (432 bits) on interface enp0s3, id 0
Ethernet II, Src: PcsCompu_e2:fb:80 (08:00:27:e2:fb:80), Dst: RealtekU_12:35:02 (52:54:00:12:35:02)
Internet Protocol Version 4, Src: 10.0.2.15, Dst: 142.251.209.142
Transmission Control Protocol, Src Port: 40538, Dst Port: 443, Seq: 931, Ack: 8736, Len: 0

No.     Time           Source                Destination           Protocol Length Info
     73 97.332549076   10.0.2.15             142.251.209.142       TCP      54     40538 → 443 [FIN, ACK] Seq=931 Ack=8736 Win=62780 Len=0

Frame 73: 54 bytes on wire (432 bits), 54 bytes captured (432 bits) on interface enp0s3, id 0
Ethernet II, Src: PcsCompu_e2:fb:80 (08:00:27:e2:fb:80), Dst: RealtekU_12:35:02 (52:54:00:12:35:02)
Internet Protocol Version 4, Src: 10.0.2.15, Dst: 142.251.209.142
Transmission Control Protocol, Src Port: 40538, Dst Port: 443, Seq: 931, Ack: 8736, Len: 0

No.     Time           Source                Destination           Protocol Length Info
     74 97.332873490   142.251.209.142       10.0.2.15             TCP      60     443 → 40538 [ACK] Seq=8736 Ack=932 Win=65535 Len=0

Frame 74: 60 bytes on wire (480 bits), 60 bytes captured (480 bits) on interface enp0s3, id 0
Ethernet II, Src: RealtekU_12:35:02 (52:54:00:12:35:02), Dst: PcsCompu_e2:fb:80 (08:00:27:e2:fb:80)
Internet Protocol Version 4, Src: 142.251.209.142, Dst: 10.0.2.15
Transmission Control Protocol, Src Port: 443, Dst Port: 40538, Seq: 8736, Ack: 932, Len: 0

No.     Time           Source                Destination           Protocol Length Info
     75 97.352509698   142.251.209.142       10.0.2.15             TCP      60     443 → 40538 [FIN, ACK] Seq=8736 Ack=932 Win=65535 Len=0

Frame 75: 60 bytes on wire (480 bits), 60 bytes captured (480 bits) on interface enp0s3, id 0
Ethernet II, Src: RealtekU_12:35:02 (52:54:00:12:35:02), Dst: PcsCompu_e2:fb:80 (08:00:27:e2:fb:80)
Internet Protocol Version 4, Src: 142.251.209.142, Dst: 10.0.2.15
Transmission Control Protocol, Src Port: 443, Dst Port: 40538, Seq: 8736, Ack: 932, Len: 0

No.     Time           Source                Destination           Protocol Length Info
     76 97.352541078   10.0.2.15             142.251.209.142       TCP      54     40538 → 443 [ACK] Seq=932 Ack=8737 Win=62780 Len=0

Frame 76: 54 bytes on wire (432 bits), 54 bytes captured (432 bits) on interface enp0s3, id 0
Ethernet II, Src: PcsCompu_e2:fb:80 (08:00:27:e2:fb:80), Dst: RealtekU_12:35:02 (52:54:00:12:35:02)
Internet Protocol Version 4, Src: 10.0.2.15, Dst: 142.251.209.142
Transmission Control Protocol, Src Port: 40538, Dst Port: 443, Seq: 932, Ack: 8737, Len: 0

No.     Time           Source                Destination           Protocol Length Info
     77 100.821186867  10.0.2.15             142.251.209.142       TCP      74     40544 → 443 [SYN] Seq=0 Win=64240 Len=0 MSS=1460 SACK_PERM=1 TSval=2637199843 TSecr=0 WS=128

Frame 77: 74 bytes on wire (592 bits), 74 bytes captured (592 bits) on interface enp0s3, id 0
Ethernet II, Src: PcsCompu_e2:fb:80 (08:00:27:e2:fb:80), Dst: RealtekU_12:35:02 (52:54:00:12:35:02)
Internet Protocol Version 4, Src: 10.0.2.15, Dst: 142.251.209.142
Transmission Control Protocol, Src Port: 40544, Dst Port: 443, Seq: 0, Len: 0

No.     Time           Source                Destination           Protocol Length Info
     78 100.846922364  142.251.209.142       10.0.2.15             TCP      60     443 → 40544 [SYN, ACK] Seq=0 Ack=1 Win=65535 Len=0 MSS=1460

Frame 78: 60 bytes on wire (480 bits), 60 bytes captured (480 bits) on interface enp0s3, id 0
Ethernet II, Src: RealtekU_12:35:02 (52:54:00:12:35:02), Dst: PcsCompu_e2:fb:80 (08:00:27:e2:fb:80)
Internet Protocol Version 4, Src: 142.251.209.142, Dst: 10.0.2.15
Transmission Control Protocol, Src Port: 443, Dst Port: 40544, Seq: 0, Ack: 1, Len: 0

No.     Time           Source                Destination           Protocol Length Info
     79 100.846961831  10.0.2.15             142.251.209.142       TCP      54     40544 → 443 [ACK] Seq=1 Ack=1 Win=64240 Len=0

Frame 79: 54 bytes on wire (432 bits), 54 bytes captured (432 bits) on interface enp0s3, id 0
Ethernet II, Src: PcsCompu_e2:fb:80 (08:00:27:e2:fb:80), Dst: RealtekU_12:35:02 (52:54:00:12:35:02)
Internet Protocol Version 4, Src: 10.0.2.15, Dst: 142.251.209.142
Transmission Control Protocol, Src Port: 40544, Dst Port: 443, Seq: 1, Ack: 1, Len: 0

No.     Time           Source                Destination           Protocol Length Info
     80 100.939809073  10.0.2.15             142.251.209.142       TLSv1.3  571    Client Hello

Frame 80: 571 bytes on wire (4568 bits), 571 bytes captured (4568 bits) on interface enp0s3, id 0
Ethernet II, Src: PcsCompu_e2:fb:80 (08:00:27:e2:fb:80), Dst: RealtekU_12:35:02 (52:54:00:12:35:02)
Internet Protocol Version 4, Src: 10.0.2.15, Dst: 142.251.209.142
Transmission Control Protocol, Src Port: 40544, Dst Port: 443, Seq: 1, Ack: 1, Len: 517
Transport Layer Security

No.     Time           Source                Destination           Protocol Length Info
     81 100.940118017  142.251.209.142       10.0.2.15             TCP      60     443 → 40544 [ACK] Seq=1 Ack=518 Win=65535 Len=0

Frame 81: 60 bytes on wire (480 bits), 60 bytes captured (480 bits) on interface enp0s3, id 0
Ethernet II, Src: RealtekU_12:35:02 (52:54:00:12:35:02), Dst: PcsCompu_e2:fb:80 (08:00:27:e2:fb:80)
Internet Protocol Version 4, Src: 142.251.209.142, Dst: 10.0.2.15
Transmission Control Protocol, Src Port: 443, Dst Port: 40544, Seq: 1, Ack: 518, Len: 0

No.     Time           Source                Destination           Protocol Length Info
     82 100.959354689  142.251.209.142       10.0.2.15             TLSv1.3  2878   Server Hello, Change Cipher Spec

Frame 82: 2878 bytes on wire (23024 bits), 2878 bytes captured (23024 bits) on interface enp0s3, id 0
Ethernet II, Src: RealtekU_12:35:02 (52:54:00:12:35:02), Dst: PcsCompu_e2:fb:80 (08:00:27:e2:fb:80)
Internet Protocol Version 4, Src: 142.251.209.142, Dst: 10.0.2.15
Transmission Control Protocol, Src Port: 443, Dst Port: 40544, Seq: 1, Ack: 518, Len: 2824
Transport Layer Security

No.     Time           Source                Destination           Protocol Length Info
     83 100.959413171  10.0.2.15             142.251.209.142       TCP      54     40544 → 443 [ACK] Seq=518 Ack=2825 Win=62780 Len=0

Frame 83: 54 bytes on wire (432 bits), 54 bytes captured (432 bits) on interface enp0s3, id 0
Ethernet II, Src: PcsCompu_e2:fb:80 (08:00:27:e2:fb:80), Dst: RealtekU_12:35:02 (52:54:00:12:35:02)
Internet Protocol Version 4, Src: 10.0.2.15, Dst: 142.251.209.142
Transmission Control Protocol, Src Port: 40544, Dst Port: 443, Seq: 518, Ack: 2825, Len: 0

No.     Time           Source                Destination           Protocol Length Info
     84 100.959729255  142.251.209.142       10.0.2.15             TLSv1.3  4023   Encrypted Extensions, Certificate, Certificate Verify, Finished

Frame 84: 4023 bytes on wire (32184 bits), 4023 bytes captured (32184 bits) on interface enp0s3, id 0
Ethernet II, Src: RealtekU_12:35:02 (52:54:00:12:35:02), Dst: PcsCompu_e2:fb:80 (08:00:27:e2:fb:80)
Internet Protocol Version 4, Src: 142.251.209.142, Dst: 10.0.2.15
Transmission Control Protocol, Src Port: 443, Dst Port: 40544, Seq: 2825, Ack: 518, Len: 3969
[2 Reassembled TCP Segments (6660 bytes): #82(2691), #84(3969)]
Transport Layer Security

No.     Time           Source                Destination           Protocol Length Info
     85 100.959740602  10.0.2.15             142.251.209.142       TCP      54     40544 → 443 [ACK] Seq=518 Ack=6794 Win=59860 Len=0

Frame 85: 54 bytes on wire (432 bits), 54 bytes captured (432 bits) on interface enp0s3, id 0
Ethernet II, Src: PcsCompu_e2:fb:80 (08:00:27:e2:fb:80), Dst: RealtekU_12:35:02 (52:54:00:12:35:02)
Internet Protocol Version 4, Src: 10.0.2.15, Dst: 142.251.209.142
Transmission Control Protocol, Src Port: 40544, Dst Port: 443, Seq: 518, Ack: 6794, Len: 0

No.     Time           Source                Destination           Protocol Length Info
     86 101.442555731  10.0.2.15             142.251.209.142       TLSv1.3  134    Change Cipher Spec, Finished

Frame 86: 134 bytes on wire (1072 bits), 134 bytes captured (1072 bits) on interface enp0s3, id 0
Ethernet II, Src: PcsCompu_e2:fb:80 (08:00:27:e2:fb:80), Dst: RealtekU_12:35:02 (52:54:00:12:35:02)
Internet Protocol Version 4, Src: 10.0.2.15, Dst: 142.251.209.142
Transmission Control Protocol, Src Port: 40544, Dst Port: 443, Seq: 518, Ack: 6794, Len: 80
Transport Layer Security

No.     Time           Source                Destination           Protocol Length Info
     87 101.442779813  142.251.209.142       10.0.2.15             TCP      60     443 → 40544 [ACK] Seq=6794 Ack=598 Win=65535 Len=0

Frame 87: 60 bytes on wire (480 bits), 60 bytes captured (480 bits) on interface enp0s3, id 0
Ethernet II, Src: RealtekU_12:35:02 (52:54:00:12:35:02), Dst: PcsCompu_e2:fb:80 (08:00:27:e2:fb:80)
Internet Protocol Version 4, Src: 142.251.209.142, Dst: 10.0.2.15
Transmission Control Protocol, Src Port: 443, Dst Port: 40544, Seq: 6794, Ack: 598, Len: 0

No.     Time           Source                Destination           Protocol Length Info
     88 101.619352796  10.0.2.15             142.251.209.142       HTTP     387    GET / HTTP/1.1 

Frame 88: 387 bytes on wire (3096 bits), 387 bytes captured (3096 bits) on interface enp0s3, id 0
Ethernet II, Src: PcsCompu_e2:fb:80 (08:00:27:e2:fb:80), Dst: RealtekU_12:35:02 (52:54:00:12:35:02)
Internet Protocol Version 4, Src: 10.0.2.15, Dst: 142.251.209.142
Transmission Control Protocol, Src Port: 40544, Dst Port: 443, Seq: 598, Ack: 6794, Len: 333
Transport Layer Security
Hypertext Transfer Protocol
    GET / HTTP/1.1\r\n
    Host: youtube.com\r\n
    User-Agent: Mozilla/5.0 (Windows NT 10.0; rv:102.0) Gecko/20100101 Firefox/102.0\r\n
    Accept: text/html,application/xhtml+xml,application/xml;q=0.9,image/avif,image/webp,*/*;q=0.8\r\n
    Accept-Encoding: gzip, deflate\r\n
    Accept-Language: en-US,en;q=0.5\r\n
    DNT: 1\r\n
    Connection: keep-alive\r\n
    \r\n
    [Full request URI: https://youtube.com/]
    [HTTP request 1/1]
    [Response in frame: 90]

No.     Time           Source                Destination           Protocol Length Info
     89 101.619657244  142.251.209.142       10.0.2.15             TCP      60     443 → 40544 [ACK] Seq=6794 Ack=931 Win=65535 Len=0

Frame 89: 60 bytes on wire (480 bits), 60 bytes captured (480 bits) on interface enp0s3, id 0
Ethernet II, Src: RealtekU_12:35:02 (52:54:00:12:35:02), Dst: PcsCompu_e2:fb:80 (08:00:27:e2:fb:80)
Internet Protocol Version 4, Src: 142.251.209.142, Dst: 10.0.2.15
Transmission Control Protocol, Src Port: 443, Dst Port: 40544, Seq: 6794, Ack: 931, Len: 0

No.     Time           Source                Destination           Protocol Length Info
     90 101.866859291  142.251.209.142       10.0.2.15             HTTP     2008   HTTP/1.1 301 Moved Permanently 

Frame 90: 2008 bytes on wire (16064 bits), 2008 bytes captured (16064 bits) on interface enp0s3, id 0
Ethernet II, Src: RealtekU_12:35:02 (52:54:00:12:35:02), Dst: PcsCompu_e2:fb:80 (08:00:27:e2:fb:80)
Internet Protocol Version 4, Src: 142.251.209.142, Dst: 10.0.2.15
Transmission Control Protocol, Src Port: 443, Dst Port: 40544, Seq: 6794, Ack: 931, Len: 1954
Transport Layer Security
Hypertext Transfer Protocol
    HTTP/1.1 301 Moved Permanently\r\n
    Content-Type: application/binary\r\n
    X-Content-Type-Options: nosniff\r\n
    Expires: Wed, 16 Aug 2023 21:13:49 GMT\r\n
    Date: Wed, 16 Aug 2023 21:13:49 GMT\r\n
    Cache-Control: private, max-age=31536000\r\n
    Location: https://www.youtube.com/\r\n
    X-Frame-Options: SAMEORIGIN\r\n
    Strict-Transport-Security: max-age=31536000; includeSubDomains; preload\r\n
    Cross-Origin-Opener-Policy-Report-Only: same-origin-allow-popups; report-to="youtube_main"\r\n
     [truncated]Origin-Trial: AvC9UlR6RDk2crliDsFl66RWLnTbHrDbp+DiY6AYz/PNQ4G4tdUTjrHYr2sghbkhGQAVxb7jaPTHpEVBz0uzQwkAAAB4eyJvcmlnaW4iOiJodHRwczovL3lvdXR1YmUuY29tOjQ0MyIsImZlYXR1cmUiOiJXZWJWaWV3WFJlcXVlc3RlZFdpdGhEZXByZWNhdGlvbiIsImV4cGlyeSI6
    Report-To: {"group":"youtube_main","max_age":2592000,"endpoints":[{"url":"https://csp.withgoogle.com/csp/report-to/youtube_main"}]}\r\n
    Permissions-Policy: ch-ua-arch=*, ch-ua-bitness=*, ch-ua-full-version=*, ch-ua-full-version-list=*, ch-ua-model=*, ch-ua-wow64=*, ch-ua-form-factor=*, ch-ua-platform=*, ch-ua-platform-version=*\r\n
    Server: ESF\r\n
    Content-Length: 0\r\n
    X-XSS-Protection: 0\r\n
    Set-Cookie: CONSENT=PENDING+006; expires=Fri, 15-Aug-2025 21:13:49 GMT; path=/; domain=.youtube.com; Secure\r\n
    P3P: CP="This is not a P3P policy! See g.co/p3phelp for more info."\r\n
    Alt-Svc: h3=":443"; ma=2592000,h3-29=":443"; ma=2592000\r\n
    \r\n
    [HTTP response 1/1]
    [Time since request: 0.247506495 seconds]
    [Request in frame: 88]
    [Request URI: https://youtube.com/]

No.     Time           Source                Destination           Protocol Length Info
     91 101.866952658  10.0.2.15             142.251.209.142       TCP      54     40544 → 443 [ACK] Seq=931 Ack=8748 Win=62780 Len=0

Frame 91: 54 bytes on wire (432 bits), 54 bytes captured (432 bits) on interface enp0s3, id 0
Ethernet II, Src: PcsCompu_e2:fb:80 (08:00:27:e2:fb:80), Dst: RealtekU_12:35:02 (52:54:00:12:35:02)
Internet Protocol Version 4, Src: 10.0.2.15, Dst: 142.251.209.142
Transmission Control Protocol, Src Port: 40544, Dst Port: 443, Seq: 931, Ack: 8748, Len: 0

No.     Time           Source                Destination           Protocol Length Info
     92 102.054352118  10.0.2.15             142.251.209.142       TCP      54     40544 → 443 [FIN, ACK] Seq=931 Ack=8748 Win=62780 Len=0

Frame 92: 54 bytes on wire (432 bits), 54 bytes captured (432 bits) on interface enp0s3, id 0
Ethernet II, Src: PcsCompu_e2:fb:80 (08:00:27:e2:fb:80), Dst: RealtekU_12:35:02 (52:54:00:12:35:02)
Internet Protocol Version 4, Src: 10.0.2.15, Dst: 142.251.209.142
Transmission Control Protocol, Src Port: 40544, Dst Port: 443, Seq: 931, Ack: 8748, Len: 0

No.     Time           Source                Destination           Protocol Length Info
     93 102.055750246  142.251.209.142       10.0.2.15             TCP      60     443 → 40544 [ACK] Seq=8748 Ack=932 Win=65535 Len=0

Frame 93: 60 bytes on wire (480 bits), 60 bytes captured (480 bits) on interface enp0s3, id 0
Ethernet II, Src: RealtekU_12:35:02 (52:54:00:12:35:02), Dst: PcsCompu_e2:fb:80 (08:00:27:e2:fb:80)
Internet Protocol Version 4, Src: 142.251.209.142, Dst: 10.0.2.15
Transmission Control Protocol, Src Port: 443, Dst Port: 40544, Seq: 8748, Ack: 932, Len: 0

No.     Time           Source                Destination           Protocol Length Info
     94 102.071884570  142.251.209.142       10.0.2.15             TCP      60     443 → 40544 [FIN, ACK] Seq=8748 Ack=932 Win=65535 Len=0

Frame 94: 60 bytes on wire (480 bits), 60 bytes captured (480 bits) on interface enp0s3, id 0
Ethernet II, Src: RealtekU_12:35:02 (52:54:00:12:35:02), Dst: PcsCompu_e2:fb:80 (08:00:27:e2:fb:80)
Internet Protocol Version 4, Src: 142.251.209.142, Dst: 10.0.2.15
Transmission Control Protocol, Src Port: 443, Dst Port: 40544, Seq: 8748, Ack: 932, Len: 0

No.     Time           Source                Destination           Protocol Length Info
     95 102.071917701  10.0.2.15             142.251.209.142       TCP      54     40544 → 443 [ACK] Seq=932 Ack=8749 Win=62780 Len=0

Frame 95: 54 bytes on wire (432 bits), 54 bytes captured (432 bits) on interface enp0s3, id 0
Ethernet II, Src: PcsCompu_e2:fb:80 (08:00:27:e2:fb:80), Dst: RealtekU_12:35:02 (52:54:00:12:35:02)
Internet Protocol Version 4, Src: 10.0.2.15, Dst: 142.251.209.142
Transmission Control Protocol, Src Port: 40544, Dst Port: 443, Seq: 932, Ack: 8749, Len: 0
